'Id','Tweet','Emotion','Anger','Joy','Surprise','Fear','Disgust','Sadness','Trust','Anticipation'
1273,We protect the countries of the Middle East they would not be safe for very long without us and yet they continue to push for higher and higher oil prices! We will remember. The OPEC monopoly must get prices down now! ,Trust,0.10017861425876617,0.11151410639286041,0.03694409132003784,0.09968138486146927,0.021265633404254913,0.043883468955755234,0.5622986555099487,0.024234071373939514
1274,Financial and jobs numbers are fantastic. There are plenty of new high paying jobs available in our great and very vibrant economy. If you are not happy where you are start looking - but also remember our economy is only getting better. Vote in Midterms! ,Joy,0.05916802957653999,0.6712303161621094,0.039365775883197784,0.04862410947680473,0.024102631956338882,0.02734069526195526,0.10565868020057678,0.02450975775718689
1275,,Joy,0.015704816207289696,0.3509698212146759,0.14494264125823975,0.07205493748188019,0.003838303266093135,0.0941551923751831,0.2866412401199341,0.03169303014874458
1276,Great new book by Jason Chaffetz appropriately called The Deep State. Very interesting indeed! ,Surprise,0.002036561258137226,0.23431052267551422,0.5064448714256287,0.020397789776325226,0.0003580444026738405,0.001545444829389453,0.14048457145690918,0.09442218393087387
1277,Just returned to the White House from the Great States of North Carolina and South Carolina where incredible work is being done on the ongoing fight against hurricane Florence. Tremendous talent and spirit! ,Joy,0.0061821541748940945,0.9195422530174255,0.00631128391250968,0.03951570764183998,0.00012378089013509452,0.0014977765968069434,0.012088865973055363,0.014738176949322224
1278,President Donald J. Trump s Administration is Providing Support to Those Impacted by Hurricane Florence ,Trust,0.0129392109811306,0.06967737525701523,0.1664971113204956,0.2509366571903229,0.009872174821794033,0.01956043764948845,0.44711539149284363,0.023401645943522453
1279,North Korea recommits to denuclearization - we ve come a long way.  ,Trust,0.002437119372189045,0.17502185702323914,0.10508062690496445,0.04245023429393768,0.0004361416504252702,0.010156407952308655,0.643267035484314,0.021150607615709305
1280,....it was impossible - and then already it s over 4% and I expect it s going to grow faster and faster. We re just getting started here. Peter Ferrara former advisor to President Reagan.  ,Fear,0.008878394030034542,0.36658018827438354,0.03584688901901245,0.3955429792404175,0.04872534051537514,0.0020813336595892906,0.11951536685228348,0.022829528898000717
1281,The recovery got started on Election Day 2016. It took Trump s Tax Cuts and Regulation Cuts to get the economy booming. Before that it was the worst and slowest economic recovery since the Great Depression. It took just 6 months for Trump to get to 3% even though they said..... ,Joy,0.12336917221546173,0.7345346808433533,0.013729317113757133,0.024155303835868835,0.0020854847971349955,0.0676603838801384,0.032873012125492096,0.0015926427440717816
1282,....returned home to the United States. Also North and South Korea will file a joint bid to host the 2032 Olympics. Very exciting! ,Surprise,0.00018507322238292545,0.10792002081871033,0.753082275390625,0.0065897260792553425,0.00017213613318745047,0.00777708925306797,0.02800494059920311,0.09626872837543488
1283,Kim Jong Un has agreed to allow Nuclear inspections subject to final negotiations and to permanently dismantle a test site and launch pad in the presence of international experts. In the meantime there will be no Rocket or Nuclear testing. Hero remains to continue being........ ,Joy,0.007118862122297287,0.8238073587417603,0.017606982961297035,0.09688067436218262,0.006123397033661604,0.005093160551041365,0.0411156602203846,0.0022539086639881134
1284,The Supreme Court is one of the main reasons I got elected President. I hope Republican Voters and others are watching and studying the Democrats Playbook. ,Joy,0.1078387051820755,0.18570421636104584,0.10660125315189362,0.11361439526081085,0.014154854230582714,0.1342429667711258,0.1547040194272995,0.1831396073102951
1285,,Joy,0.015704816207289696,0.3509698212146759,0.14494264125823975,0.07205493748188019,0.003838303266093135,0.0941551923751831,0.2866412401199341,0.03169303014874458
1286,Today it was my great honor to welcome  Andrzej Duda of Poland to the  ! ,Surprise,0.001269771484658122,0.2031182199716568,0.7245045304298401,0.018208608031272888,0.00019447800877969712,0.0021067862398922443,0.0325264073908329,0.01807119883596897
1287,Today I took action to strengthen our Nation s defenses against biological threats. For the first time in history the Federal Government has a National Biodefense Strategy to address the FULL RANGE of biological threats! ,Fear,0.08740755170583725,0.2791323959827423,0.047724995762109756,0.3865942358970642,0.07502509653568268,0.0020099221728742123,0.02365562878549099,0.09845016151666641
1288,Thank you to our great Coast Guard for doing such a tremendous job - thousands of lives being saved! ,Joy,0.0003824099840130657,0.9510930180549622,0.011117239482700825,0.0007916403119452298,4.077473931829445e-05,0.0018819629913195968,0.03104577213525772,0.0036472072824835777
1289,...that FEMA our Military and our First Responders who are all unbelievable are a disaster and not doing a good job. This will be a total lie but that s what they do and everybody knows it! ,Trust,0.03307972103357315,0.012489947490394115,0.01082365121692419,0.06621186435222626,0.014639037661254406,0.007960094138979912,0.8525335788726807,0.0022620761301368475
1290,Right now everybody is saying what a great job we are doing with Hurricane Florence and they are 100% correct. But don t be fooled at some point in the near future the Democrats will start ranting... ,Trust,0.009790354408323765,0.1200665533542633,0.009530829265713692,0.08737814426422119,0.0016749576898291707,0.15029862523078918,0.6200714111328125,0.0011891055619344115
1291,Happy 71st Birthday to our GREAT United States Air Force! ,Surprise,0.0002068565518129617,0.06938928365707397,0.8757639527320862,0.0019836141727864742,8.119661652017385e-05,0.0005594490794464946,0.019783664494752884,0.03223201259970665
1292,.....China has been taking advantage of the United States on Trade for many years. They also know that I am the one that knows how to stop it. There will be great and fast economic retaliation against China if our farmers ranchers and/or industrial workers are targeted! ,Trust,0.03153402358293533,0.0906924307346344,0.015865802764892578,0.06512369960546494,0.009429903700947762,0.0004713710804935545,0.7374138832092285,0.04946887493133545
1293,China has openly stated that they are actively trying to impact and change our election by attacking our farmers ranchers and industrial workers because of their loyalty to me. What China does not understand is that these people are great patriots and fully understand that..... ,Joy,0.030324310064315796,0.46536242961883545,0.05127065256237984,0.02220599539577961,0.0017945049330592155,0.02204570360481739,0.4068000316619873,0.00019636035722214729
1294,....campaign which is unprecedented in our history. Congressman Peter King Really bad things were happening but they are now being exposed. Big stuff! ,Joy,0.038796234875917435,0.6028241515159607,0.012006185948848724,0.13831943273544312,0.025762153789401054,0.06680868566036224,0.11481211334466934,0.0006710308371111751
1295,What will be disclosed is that there was no basis for these FISA Warrants that the important information was kept from the court there s going to be a disproportionate influence of the (Fake) Dossier. Basically you have a counter terrorism tool used to spy on a presidential... ,Fear,0.005678398068994284,0.06046784669160843,0.03815803676843643,0.47601836919784546,0.11533349752426147,0.013749639503657818,0.2891317903995514,0.0014624320901930332
1296,Today as we celebrate Hispanic Heritage Month we share our gratitude for all the ways Hispanic-Americans make our country flourish and prosper. Today and every day we honor cherish and celebrate Hispanic-American Workers Families Students Businesses and Leaders... ,Joy,0.004328508861362934,0.9898200035095215,0.0007566310814581811,0.000666461419314146,0.0006723362021148205,0.0015563353663310409,0.0019034696742892265,0.00029626439209096134
1297,Just met John James of Michigan. He has every single quality to be your next Great Senator from Michigan. When the people of Michigan get to know John they will say he is a true star. Also distinguished Military and a Combat Vet! ,Fear,0.00770274642854929,0.03591568022966385,0.0351085290312767,0.5922214984893799,0.14211434125900269,0.008968919515609741,0.1651681661605835,0.012800140306353569
1298,It was my great honor to host today s Inaugural Meeting of the President s National Council for the American Worker in the Roosevelt Room! Read more: ,Anticipation,0.012834957800805569,0.30388495326042175,0.03387858718633652,0.22890055179595947,0.026883035898208618,0.0014061678666621447,0.02302725613117218,0.3691844940185547
1299,,Joy,0.015704816207289696,0.3509698212146759,0.14494264125823975,0.07205493748188019,0.003838303266093135,0.0941551923751831,0.2866412401199341,0.03169303014874458
1300,Happy Constitution Day! ,Joy,0.00019907124806195498,0.9661490321159363,0.0027536635752767324,0.002899552695453167,5.060793046141043e-05,0.00047981913667172194,0.007957213558256626,0.019511040300130844
1301,Join me in Las Vegas Nevada at 7:00pm for a MAKE AMERICA GREAT AGAIN RALLY! Tickets: ,Joy,0.00218801642768085,0.33994656801223755,0.25341880321502686,0.019858134910464287,0.0004364721244201064,0.005504897329956293,0.2866899073123932,0.0919572114944458
1302,Americans deserve to know the lowest drug price at their pharmacy but gag clauses prevent your pharmacist from telling you! I support legislation that will remove gag clauses and urge the Senate to act. #AmericanPatientsFirst ,Joy,0.014479552395641804,0.37525495886802673,0.041031498461961746,0.17049071192741394,0.07525667548179626,0.014795489609241486,0.2889159023761749,0.01977521926164627
1303,Immediately after Comey s firing Peter Strzok texted to his lover Lisa Page We need to Open the case we ve been waiting on now while Andy (McCabe also fired) is acting. Page answered We need to lock in (redacted). In a formal chargeable way. Soon. Wow a conspiracy caught? ,Joy,0.021923277527093887,0.62143474817276,0.017175717279314995,0.17243745923042297,0.003615752561017871,0.00940798968076706,0.1517743170261383,0.002230745740234852
1304,Lisa Page Testimony- NO EVIDENCE OF COLLUSION BEFORE MUELLER APPOINTMENT.  by Catherine Herridge. Therefore the case should never have been allowed to be brought. It is a totally illegal Witch Hunt! ,Trust,0.1057967022061348,0.0035050720907747746,0.0023000757209956646,0.03900855779647827,0.008473345078527927,0.00019657050142996013,0.8406066298484802,0.00011304156214464456
1305,Our Steel Industry is the talk of the World. It has been given new life and is thriving. Billions of Dollars is being spent on new plants all around the country! ,Joy,0.0057215276174247265,0.8232300281524658,0.00275391130708158,0.046407874673604965,0.0018687712727114558,0.0009480475564487278,0.11843530833721161,0.0006345301517285407
1306,Tariffs have put the U.S. in a very strong bargaining position with Billions of Dollars and Jobs flowing into our Country - and yet cost increases have thus far been almost unnoticeable. If countries will not make fair deals with us they will be Tariffed! ,Trust,0.17885148525238037,0.09989241510629654,0.04798101633787155,0.10470069944858551,0.09925156086683273,0.011269406415522099,0.44772377610206604,0.010329658165574074
1307,A lot of small & medium size enterprises are registering very good profit sometimes record profits-there stocks are doing very well low income workers are getting big raises. There are an awful lot of good things going on that weren t during Pres. Obama s Watch. Peter Morici ,Trust,0.017860667780041695,0.04288633540272713,0.08706247806549072,0.22347106039524078,0.03761701285839081,0.003743719309568405,0.5729748010635376,0.014383903704583645
1308,Consumer Sentiment hit its highest level in 17 years this year. Sentiment fell 11% in 2015 an Obama year and rose 16% since the Election #TrumpTime ! ,Joy,0.005846224259585142,0.522963285446167,0.07732837647199631,0.12143430858850479,0.012134939432144165,0.041238926351070404,0.11763045191764832,0.1014234647154808
1309,Best economic numbers in decades. If the Democrats take control kiss your newfound wealth goodbye! ,Surprise,0.02707497961819172,0.12346360087394714,0.40015581250190735,0.020669933408498764,0.006003309972584248,0.20770017802715302,0.1306614875793457,0.08427069336175919
1310,Watch  at 6:00 P.M. on  . Russian Hoax the big topic! Mainstream Media often referred to as the Fake News Media hates to discuss the real facts! ,Trust,0.06986270099878311,0.19209705293178558,0.06326818466186523,0.2803770899772644,0.06811237335205078,0.008804784156382084,0.3081625699996948,0.009315261617302895
1311,Congratulations to all of our Mexican friends on National Independence Day. We will be doing great things together! ,Joy,0.0004066690453328192,0.6194410920143127,0.17788231372833252,0.0019213487394154072,0.00010846819350263104,0.00222593592479825,0.13290591537952423,0.06510824710130692
1312,FEMA First Responders and Law Enforcement are working really hard on hurricane Florence. As the storm begins to finally recede they will kick into an even higher gear. Very Professional! ,Joy,0.003454220946878195,0.5804039835929871,0.01354982890188694,0.020202448591589928,0.0019520445493981242,0.0019503901712596416,0.3738586902618408,0.004628398921340704
1313,The illegal Mueller Witch Hunt continues in search of a crime. There was never Collusion with Russia except by the Clinton campaign so the 17 Angry Democrats are looking at anything they can find. Very unfair and BAD for the country. ALSO not allowed under the LAW! ,Anger,0.7089789509773254,0.12246399372816086,0.009527051821351051,0.00698572164401412,0.013899102807044983,0.1336582899093628,0.004395679105073214,9.123650670517236e-05
1314,Exclusive -- Donald Trump Jr. to Obama: My Dad Fixed the Economy You Could Not ,Trust,0.02563485875725746,0.06697937101125717,0.19939598441123962,0.09220793843269348,0.003471334697678685,0.03535453602671623,0.5704934597015381,0.0064625367522239685
1315,Five deaths have been recorded thus far with regard to hurricane Florence! Deepest sympathies and warmth go out to the families and friends of the victims. May God be with them! ,Fear,0.024331053718924522,0.1818017214536667,0.007550355512648821,0.4813583493232727,0.0017043789848685265,0.006349765229970217,0.29354745149612427,0.0033569326624274254
1316,When will Republican leadership learn that they are being played like a fiddle by the Democrats on Border Security and Building the Wall? Without Borders we don t have a country. With Open Borders which the Democrats want we have nothing but crime! Finish the Wall! ,Trust,0.15718814730644226,0.21155135333538055,0.012373902834951878,0.04578230902552605,0.006981259677559137,0.01457684300839901,0.5508360862731934,0.0007101068622432649
1317,While my (our) poll numbers are good with the Economy being the best ever if it weren t for the Rigged Russian Witch Hunt they would be 25 points higher! Highly conflicted Bob Mueller & the 17 Angry Democrats are using this Phony issue to hurt us in the Midterms. No Collusion! ,Trust,0.038144487887620926,0.1233818307518959,0.005566003266721964,0.3073905110359192,0.0013734492240473628,0.03700532019138336,0.48616325855255127,0.0009751219768077135
1318,.  of Nevada is a great friend who supports the Trump Agenda. He is Strong on Crime the Border and our under siege 2nd Amendment. Danny Loves our Military and our Vets. He has my total and complete Endorsement! ,Joy,0.0025212287437170744,0.5769801735877991,0.00931836199015379,0.046905260533094406,0.0012739464873448014,0.003079558489844203,0.33525338768959045,0.02466806024312973
1319,Congressman Keith Rothfus continues to do a great job for the people of Pennsylvania. Keith is strong on Crime the Border and our Second Amendment. Loves our Military and our Vets. He has my total Endorsement! ,Joy,0.01070122979581356,0.796629011631012,0.007869808934628963,0.06602522730827332,0.0021605659276247025,0.0021119441371411085,0.08352546393871307,0.030976716428995132
1320,Congressman Pete Sessions of Texas is doing a great job. He is a fighter who will be tough on Crime and the Border fight hard for our Second Amendment and loves our Military and our Vets. He has my full and complete Endorsement! ,Joy,0.024753430858254433,0.7983641028404236,0.002275628037750721,0.0591593012213707,0.00021819908579345793,0.0014749685069546103,0.11310520768165588,0.0006491455133073032
1321,Thank you Brock it is my honor! We (  ) have never had the support that we have had from this President. Administrator  ,Joy,0.00287421396933496,0.5518730282783508,0.21952253580093384,0.07068843394517899,0.0005917726666666567,0.02191629447042942,0.10022563487291336,0.032308075577020645
1322,Thank you  ! ,Surprise,0.0028351000510156155,0.2548578083515167,0.6100860834121704,0.014118945226073265,0.0005260752514004707,0.0008600068395026028,0.11004433035850525,0.00667165033519268
1323,When President Obama said that he has been to 57 States very little mention in Fake News Media. Can you imagine if I said that...story of the year!  ,Trust,0.0018817894160747528,0.17621612548828125,0.19994685053825378,0.030866459012031555,0.006167878862470388,0.015023820102214813,0.5563437342643738,0.013553339056670666
1324,....GWU Research to tell them how many people had died in Puerto Rico (how would they not know this?). This method was never done with previous hurricanes because other jurisdictions know how many people were killed. FIFTY TIMES LAST ORIGINAL NUMBER - NO WAY! ,Joy,0.055117473006248474,0.7056220769882202,0.005675020162016153,0.17984339594841003,0.00028873005066998303,0.003966509364545345,0.0491887703537941,0.0002980280260089785
1325,When Trump visited the island territory last October OFFICIALS told him in a briefing 16 PEOPLE had died from Maria. The Washington Post. This was long AFTER the hurricane took place. Over many months it went to 64 PEOPLE. Then like magic 3000 PEOPLE KILLED. They hired.... ,Sadness,0.043853141367435455,0.03622531518340111,0.011906947940587997,0.248973548412323,0.06955210119485855,0.544855535030365,0.04420056566596031,0.00043285396532155573
1326,Great job FEMA First Responders and Law Enforcement - not easy very dangerous tremendous talent. America is proud of you. Keep it all going - finish strong! ,Trust,0.0035459324717521667,0.027992311865091324,0.0033855908550322056,0.29859447479248047,0.0017848858842626214,0.0014043091796338558,0.6559100151062012,0.007382447365671396
1327,My thoughts and prayers are with Evelyn Rodriguez this evening along with her family and friends. #RIPEvelyn ,Sadness,0.0002382017410127446,0.004544062074273825,0.0016754663083702326,0.00041757471626624465,4.2776839109137654e-05,0.9889712929725647,0.003607883583754301,0.000502728100400418
1328,The story of Puerto Rico is the rebuilding that has occurred. The President has done an extraordinary job of cleanup rebuilding electrical stuff and everything else.  The people of Puerto Rico have one of the most corrupt governments in our country.  ,Joy,0.0015781286638230085,0.9292548894882202,0.0009342161356471479,0.05587533861398697,0.0012327490840107203,0.0015174890868365765,0.009394887834787369,0.00021229794947430491
1329,They say all these people died in the storm in Puerto Rico yet 70% of the power was out before the storm. So when did people start dying? At what point do you recognize that what they are doing is a political agenda couched in the nice language of journalism?  ,Sadness,0.10817427933216095,0.06022163853049278,0.23309548199176788,0.19941364228725433,0.0045259189791977406,0.2655891180038452,0.11072287708520889,0.01825704798102379
1330,Keep up the great work - THANK YOU! ,Trust,0.003288509324193001,0.31609636545181274,0.1963542103767395,0.0134428134188056,0.00034727700403891504,0.0013649372849613428,0.4321897625923157,0.03691612556576729
1331,We love the #CajunNavy - THANK YOU! #FlorenceHurricane2018 ,Surprise,0.0002038500242633745,0.3302987515926361,0.42758601903915405,0.007323454599827528,2.5890660253935494e-05,0.0014063304988667369,0.19726552069187164,0.03589016944169998
1332,Incredible job being done by FEMA First Responders Law Enforcement and all. Thank you! ,Joy,0.00032417415059171617,0.727601945400238,0.1292218267917633,0.0020508826710283756,2.9811408239766024e-05,0.001958607230335474,0.0971628874540329,0.04164988547563553
1333,Gina is Great! ,Joy,0.0019834302365779877,0.6895602941513062,0.10625988245010376,0.004397778771817684,0.0004210532642900944,0.004494696855545044,0.17772439122200012,0.015158481895923615
1334,John Kerry had illegal meetings with the very hostile Iranian Regime which can only serve to undercut our great work to the detriment of the American people. He told them to wait out the Trump Administration! Was he registered under the Foreign Agents Registration Act? BAD! ,Surprise,0.0638071820139885,0.17348362505435944,0.4960881471633911,0.10736296325922012,0.025258153676986694,0.015790816396474838,0.030410831794142723,0.08779828995466232
1335,Senator Debbie Stabenow and the Democrats are totally against approving the Farm Bill. They are fighting tooth and nail to not allow our Great Farmers to get what they so richly deserve. Work requirements are imperative and the Dems are a NO. Not good! ,Joy,0.07407411932945251,0.41016900539398193,0.015853270888328552,0.1544903665781021,0.00460516894236207,0.02573043666779995,0.3104006052017212,0.004677047487348318
1336,Thank you  ! #HurricaneFlorence ,Surprise,0.05416220426559448,0.21855050325393677,0.4032942056655884,0.04593732953071594,0.0009879369754344225,0.0027336671482771635,0.2715335786342621,0.0028005579952150583
1337,I was just briefed on Hurricane Florence. FEMA First Responders and Law Enforcement are supplied and ready. We are with you! ,Joy,0.0023820223286747932,0.27477389574050903,0.26633936166763306,0.01126810722053051,0.00025925878435373306,0.005137521307915449,0.27314338088035583,0.1666964590549469
1338,Thank you  ! ,Surprise,0.0028351000510156155,0.2548578083515167,0.6100860834121704,0.014118945226073265,0.0005260752514004707,0.0008600068395026028,0.11004433035850525,0.00667165033519268
1339,The Wall Street Journal has it wrong we are under no pressure to make a deal with China they are under pressure to make a deal with us. Our markets are surging theirs are collapsing. We will soon be taking in Billions in Tariffs & making products at home. If we meet we meet? ,Joy,0.004850646946579218,0.9252092242240906,0.0022132080048322678,0.0518958605825901,0.0005969871999695897,0.00034328579204156995,0.013896307907998562,0.0009944640332832932
1340,.....This was done by the Democrats in order to make me look as bad as possible when I was successfully raising Billions of Dollars to help rebuild Puerto Rico. If a person died for any reason like old age just add them onto the list. Bad politics. I love Puerto Rico! ,Trust,0.127443328499794,0.011110899038612843,0.05482519790530205,0.19669102132320404,0.11652375757694244,0.027539657428860664,0.4586394727230072,0.007226674351841211
1341,3000 people did not die in the two hurricanes that hit Puerto Rico. When I left the Island AFTER the storm had hit they had anywhere from 6 to 18 deaths. As time went by it did not go up by much. Then a long time later they started to report really large numbers like 3000... ,Fear,0.00498040160164237,0.09129278361797333,0.014645824208855629,0.7688092589378357,0.00024786716676317155,0.05005040019750595,0.02664763294160366,0.04332583397626877
1342,Middle-Class Income Hits All-Time High!  And will continue to rise (unless the Dems get in and destroy what we have built). ,Trust,0.030341260135173798,0.12043589353561401,0.037687331438064575,0.05824599415063858,0.011884045787155628,0.027315089479088783,0.6785178780555725,0.03557252883911133
1343,..... It is a cesspool of corruption and the people who did this need to be brought to justice.  ,Trust,0.18105806410312653,0.1402105689048767,0.1533583551645279,0.037241410464048386,0.09872627258300781,0.07144235819578171,0.3111702799797058,0.006792666856199503
1344,More text messages between former FBI employees Peter Strzok and Lisa Page are a disaster and embarrassment to the FBI & DOJ. This should never have happened but we are learning more and more by the hour. Others were leaking like mad in order to get the President! ........ ,Trust,0.010376239195466042,0.22889825701713562,0.19062106311321259,0.030269525945186615,0.0015903785824775696,0.03979470580816269,0.4973325729370117,0.0011172585655003786
1345,We are completely ready for hurricane Florence as the storm gets even larger and more powerful. Be careful! ,Trust,0.004795433953404427,0.13363724946975708,0.026108121499419212,0.028301715850830078,0.00016711087664589286,0.00260328920558095,0.7670196294784546,0.037367478013038635
1346,The problem with banker Jamie Dimon running for President is that he doesn t have the aptitude or smarts & is a poor public speaker & nervous mess - otherwise he is wonderful. I ve made a lot of bankers and others look much smarter than they are with my great economic policy! ,Fear,0.0074847666546702385,0.28735584020614624,0.08293864130973816,0.35184043645858765,0.008933735080063343,0.0016622110269963741,0.2019522488117218,0.05783212557435036
1347,Tonight it was my great honor to host a Congressional Medal of Honor Society Reception at the  ! ,Fear,0.00636649876832962,0.012522071599960327,0.0493590384721756,0.7822329998016357,0.004550994839519262,0.003306621452793479,0.1239577904343605,0.017704011872410774
