'Id','Tweet','Emotion','Anger','Joy','Surprise','Fear','Disgust','Sadness','Trust','Anticipation'
432,Ms. Shaila R.N worked very hard to improve the overall infrastructure of a school that she is heading in Bengaluru North. Her work has made a positive difference in the lives of several students particularly those belonging to poor families. Proud of teachers like her! ,Joy,0.01395123265683651,0.48207929730415344,0.07921014726161957,0.038796909153461456,0.0033173388801515102,0.010293886996805668,0.29676905274391174,0.0755821242928505
433,Shri Sashanka Hazarika from Darrang Assam has encouraged computerization and development of software for classrooms. He has taken education to more and more children through his work in increasing enrolment. I wish him success in his noble endeavours. ,Trust,0.015255622565746307,0.29046547412872314,0.11520826816558838,0.042586877942085266,0.0022395963314920664,0.20391757786273956,0.32780757546424866,0.0025189993903040886
434,Shri Sarvest Kumar Ji s efforts have led to a huge increase in his school s enrolment count in Basti district of Uttar Pradesh. Great to meet him! He even shared how introduction of ICT in his school is enhancing the teaching-learning process and benefitting the students. ,Joy,0.009309940971434116,0.6300569176673889,0.008629590272903442,0.20649336278438568,0.00745618948712945,0.0007182966219261289,0.12134306132793427,0.015992609784007072
435,Shri Santosh Gaonkar is the Principal of Poira High School in Goa. Under his leadership the school saw a significant improvement in Class X results. He also worked to make the sciences popular among pupils with his students even taking part in the Children s Science Congress. ,Joy,0.012041062116622925,0.43796685338020325,0.03889717161655426,0.14278355240821838,0.00045161283924244344,0.0021770582534372807,0.3651005029678345,0.0005821724771521986
436,Shri GH Rasool Mir Ji s efforts to mobilise parents and local community in Srinagar for increasing student enrolment and reduce absenteeism from school are laudable. His active participation to set up a school library and upgrade labs are praiseworthy. Glad to have met him! ,Joy,0.006134750787168741,0.6398913264274597,0.03001210279762745,0.04495120793581009,0.03413187712430954,0.0005444021080620587,0.06902314722537994,0.17531119287014008
437,When students are fit India is fit! As the Physical Education teacher of a school in rural Bengaluru Dr. Rameshappa popularises Yoga and sports among students. His work towards gender sensitivity and welfare of Divyang students is noteworthy. Congrats and best wishes to him. ,Joy,0.0010176474461331964,0.6825262308120728,0.010101591236889362,0.01111514214426279,0.0001113959078793414,0.002113641705363989,0.292728990316391,0.00028533482691273093
438,As the Headmistress of a school in Coimbatore Ms. R Sathy adopted several community mobilisation activities to increase enrolment. Her innovative strategies helped her local village in becoming ODF. She is also passionate about co-curricular activities. Congratulations to her. ,Joy,0.046432144939899445,0.39272984862327576,0.2567978501319885,0.07203701138496399,0.010402231477200985,0.046555258333683014,0.1713714599609375,0.003674206091091037
439,Ms. Pragya Nopany of Birla Vidya Niketan Delhi has taught Physics to thousands of students. She has also participated actively in developing national level curriculum and in developing teacher training programmes. We are proud of her contribution. ,Joy,0.08032991737127304,0.47271373867988586,0.004828726872801781,0.29927971959114075,0.0012010474456474185,0.03952299430966377,0.049842268228530884,0.05228159576654434
440,Shri Rakeshkumar Chandrakant Patel is a teacher well-known in Nadisar for increasing enrolment through his community linkages and effective use of social media. Also a blogger on education techniques he is an asset to his students and our nation. ,Trust,0.01566952094435692,0.09864700585603714,0.029486708343029022,0.29342490434646606,0.1493561565876007,0.02399553544819355,0.3650968372821808,0.024323346093297005
441,Met Shri Omprakash Mishra Ji from Jeypore in Koraput district of Odisha. I salute him for his sheer determination to educate students in one of the remotest areas of our country. His effective use of school labs and technology in teaching of science and mathematics is noteworthy. ,Joy,0.10122036188840866,0.49041107296943665,0.016496451571583748,0.08892037719488144,0.18303006887435913,0.0173015333712101,0.09494926780462265,0.0076708621345460415
442,Shri Narra Rama Rao Headmaster of a school in Nizamabad Telangana played the lead role in significantly enhancing the enrolment of children in his school. He has also popularized science among students. I appreciate Shri Rao for his commitment and wish him all the best. ,Trust,0.003074882086366415,0.25273987650871277,0.037385161966085434,0.2130197137594223,0.00979728065431118,0.011769827455282211,0.45719411969184875,0.015019122511148453
443,It was good meeting Shri Narendra Kumar Tiwari from Chhattisgarh. His school has high levels of student participation and good performance of students in the examinations. He mobilised substantial support for his school from the community. Congratulations for the Teachers Award. ,Joy,0.06790882349014282,0.4531446695327759,0.1998944729566574,0.0558491125702858,0.05208274722099304,0.04646216705441475,0.03431086242198944,0.09034713357686996
444,Shri Murugan is a mathematics and science teacher in Nagaland. Through his innovative approach he has helped students develop keen interest in these subjects. His efforts to organise the District Science Congress and teacher training workshops are highly appreciable. ,Trust,0.007788901217281818,0.19556941092014313,0.02074739895761013,0.19062821567058563,0.001092548598535359,0.0034651756286621094,0.5800360441207886,0.000672289403155446
445,Glad to have met Shri Motilal Koirala of Sikkim. His efforts towards enhancing academic level through the use of IT are commendable. As the Principal of his school his extensive outreach to parents and guardians are appreciable and augurs well for the students. Congrats to him. ,Joy,0.004678234923630953,0.6703186631202698,0.25756049156188965,0.017762407660484314,0.011998826637864113,0.010622374713420868,0.022208580747246742,0.004850409924983978
446,Ms. Meka Susatya Rekha a teacher of Mathematics and Science in Rajahmundry Andhra Pradesh has successfully ensured that students find classroom interactions absorbing. She has worked on the creation and dissemination of e-content. I wish her well in all her future endeavours. ,Fear,0.005645948927849531,0.14540469646453857,0.004269111901521683,0.5013667941093445,0.00012379666441120207,0.009655323810875416,0.3192748427391052,0.014259516261518002
447,Teaching is about educating students and mentoring other teachers too. Ms. Manu Gulati is a shining beacon in this. She has also developed innovative methods of teaching through technology music and dance. Delighted that she wins the National Award for Teachers. ,Joy,0.02565508335828781,0.7593304514884949,0.05651610717177391,0.06672689318656921,0.009852255694568157,0.0036002122797071934,0.07181603461503983,0.006502951495349407
448,Ms. Manju Balasubramanyam heads the DPS in Bengaluru. Her work towards increasing diversity and focussing in opportunity as well as inclusion for Divyang children are commendable. Congratulated her on being conferred the prestigious award for teachers. ,Disgust,0.13722801208496094,0.09070838987827301,0.08609767258167267,0.04662556201219559,0.5383526086807251,0.0885661318898201,0.010350494645535946,0.0020710951648652554
449,Starting from basics Ms. Mamta Awasthy from Sikkim developed innovative teaching practices at the primary school level. She also compiled her best practices which are being disseminated and helping several other youngsters study. ,Joy,0.061014287173748016,0.42673179507255554,0.009430532343685627,0.31302836537361145,0.0024734418839216232,0.002789103426039219,0.18318414688110352,0.0013483274960890412
450,Pleasure meeting Shri Shivakumar Ji from Karnataka s Chikkaballapura district. It was great to know that using technology he has simplified Mathematical queries for his students. Many of his classroom videos are available on the internet and are widely appreciated. ,Joy,0.049490172415971756,0.5088392496109009,0.12471383810043335,0.12016826122999191,0.09430567920207977,0.018397878855466843,0.06999795883893967,0.01408698596060276
451,As the Headmaster of a school in Pasighat Arunachal Pradesh Shri Lutni Perme has not only helped the school improve its academic performance but has also laid emphasis on holistic education through gardening sports and other activities. The nation is proud of him. ,Surprise,0.04594523087143898,0.24486473202705383,0.3474682867527008,0.1397666484117508,0.04602015018463135,0.06126292794942856,0.08483162522315979,0.029840389266610146
452,Shri Kirandeep Singh who teaches in Ludhiana has done excellent work in popularising Mathematics among youngsters. He has set up a Maths hub maths park created interesting modules all so that students enjoy the subject and excel in it. Glad that he got the teachers award. ,Joy,0.2722046971321106,0.4173597991466522,0.05984192714095116,0.141188383102417,0.04064881429076195,0.018840525299310684,0.04281000792980194,0.0071058389730751514
453,Shri Khangembam Indrakumar Singh from Manipur worked hard to spread the message of the importance of primary education. He has also worked on special residential programmes to help students pick up key concepts. He is an inspiration to students and other teachers. ,Joy,0.03266032412648201,0.6250792145729065,0.04319183528423309,0.10118034482002258,0.005849017761647701,0.03185136616230011,0.13568806648254395,0.024499844759702682
454,Heading a school in North Sikkim Ms. Karma Chomu Bhutia devoted attention to every aspect of education ranging from enrolment proper mid day meals using technology and new learning methods. Delighted that she is receiving a prestigious award for educators. ,Joy,0.011194730177521706,0.6801350712776184,0.1699356734752655,0.0438125915825367,0.00315331993624568,0.008481179364025593,0.06682314723730087,0.016464300453662872
455,Met Ms. Jayanthi Sheshadri who has shown tremendous passion towards improving rural education. She has created innovative modules and conducted workshops to spread the joys of learning. Congratulations to her. ,Joy,0.0029678447172045708,0.9811533689498901,0.008982046507298946,0.0010341837769374251,0.00017522269627079368,0.0014406252885237336,0.0039295474998652935,0.00031713180942460895
456,Meet Shri Ishwari Kumar Sinha from Chhattisgarh. He has made science teaching more meaningful and effective through use of experiments and and through field activities. He has also been devoting out of school hours for supporting children with learning difficulties. ,Joy,0.03167703002691269,0.5075199604034424,0.0595799945294857,0.04893134906888008,0.11392924934625626,0.04541483521461487,0.15349885821342468,0.039448726922273636
457,Met Shri Mohammad Imran Khan Mewati from Alwar. I appreciate him for developing educational e-content including videos website and even Mobile Apps. His Apps cover a range of subjects at primary and secondary level as well as for competitive examinations. Congrats to him. ,Joy,0.03695135936141014,0.590549647808075,0.23316337168216705,0.03663991391658783,0.04021657630801201,0.01815568096935749,0.03550449386239052,0.008818922564387321
458,Generations of students will thank Shri Hydros CK based in Wayanad Kerala for his determined focus on learning outcomes. He gave students innovative projects on areas such as robotics which contributed to the building of a scientific temper among young minds. Proud of him. ,Joy,0.3087282180786133,0.5320193767547607,0.04004744067788124,0.05208516865968704,0.0076764365658164024,0.005205785855650902,0.05353415384888649,0.0007034287555143237
459,Shri Harinder Singh Grewal is an example of how teachers can master technology and benefit students. His innovative use of technology for teaching and experiments on learning aids are laudable. I wish him all the best for the future. ,Joy,0.029807915911078453,0.656141996383667,0.009510640986263752,0.012040620669722557,0.0005898815579712391,0.04645443335175514,0.20388951897621155,0.041565004736185074
460,Meet my friend Shri GS Zaithantluanga from Mizoram. Along with developing a scientific temper among students he is helping students excel in cultural competitions. He has initiated the adoption of vocational education and skill training in the school too. Proud of him. ,Trust,0.004590827971696854,0.3579707145690918,0.002346714958548546,0.07983317226171494,0.0019088203553110361,0.0009613335714675486,0.541228175163269,0.011160219088196754
461,Interacted with Dr. Gopal Jee the Principal of a school in Bihar s Sitamarhi. His work on environmental conservation is outstanding. He has also worked hard to improve literacy rates in his district and always inspires students to study harder so that they can fight poverty. ,Trust,0.00898640789091587,0.0459621399641037,0.05047573521733284,0.08911862969398499,0.02296486869454384,0.005558956414461136,0.7745331525802612,0.002400130731984973
462,Even though she heads a school in Delhi s Rohini Ms. Geeta Gangwani continues to teach Chemistry and has developed innovative methods to make the subject more popular. As an administrator her emphasis on IT has benefitted the school greatly. Congratulations to her! ,Trust,0.05251001939177513,0.32981204986572266,0.10357803106307983,0.0737476646900177,0.024001941084861755,0.008528298698365688,0.40107136964797974,0.006750613916665316
463,Encouraging group discussions in classrooms ensuring regular use of science and computer labs in teaching and improving school infrastructure are some of the laudable things Shri B S Ravi has done in his school in Gadwal Telangana. We are proud of his work. ,Trust,0.007812848314642906,0.1620168387889862,0.0052380748093128204,0.032139506191015244,0.0026405949611216784,0.003925251308828592,0.7844063639640808,0.0018205244559794664
464,Shri Basruddin Khan from Haryana is a Headmaster who has played a key role in promoting the education of girls. He has also made a significant contribution towards identification and enrolment of out-of-school children. Congratulations to him for the National Award for Teachers. ,Joy,0.0029303780756890774,0.9798809885978699,0.0032883824314922094,0.0021051971707493067,0.0019284227164462209,0.0005970973870716989,0.008453895337879658,0.0008156408439390361
465,Shri Bandari Ramesh from Warangal Telangana has worked on innovative teaching methods for mathematics. As a prolific developer of teaching-learning material he has helped ensure excellent results in his school. I wish him all the best for continuing his good work. ,Trust,0.033582549542188644,0.2614099979400635,0.06769143044948578,0.17297081649303436,0.005333852954208851,0.061186254024505615,0.3770049512386322,0.020820146426558495
466,Shri Pari Baldevpari Javerpari from Junagadh Gujarat makes learning mathematics enjoyable for students. He has developed several Mobile Apps that help students learn the subject. His classroom videos are also widely watched. May his kind increase. ,Joy,0.02322484739124775,0.3446340262889862,0.15820163488388062,0.10435634106397629,0.026174377650022507,0.007642420474439859,0.3153820335865021,0.02038431540131569
467,Students really like Shri Arvind Raj Jajware's joyful teaching methods. He has made a significant contribution in enhancing enrolment and attendance in his school in Jharkhand. He also shares best practices of teaching with others. More power to him! ,Joy,0.0008958615362644196,0.49684134125709534,0.0026924293488264084,0.01601034216582775,0.0004153147165197879,0.0004024788795504719,0.48123472929000854,0.0015075013507157564
468,Great meeting Shri Amitava Misra from West Bengal s Purulia district. The transformation he has brought about in his school by mobilising people is remarkable. Glad to know that he even teaches students from marginalized communities during out of school hours and holidays. ,Trust,0.06123921275138855,0.17829211056232452,0.013181749731302261,0.01811959780752659,0.08281346410512924,0.0037798513658344746,0.6408801078796387,0.0016938963672146201
469,On the eve of #TeachersDay interacted with those who have been conferred the National Award to Teachers. ,Joy,0.0037815673276782036,0.7464738488197327,0.13349004089832306,0.00992484763264656,0.004989360459148884,0.03555508330464363,0.030492376536130905,0.035292863845825195
470,The collapse of a part of a bridge in Kolkata is deeply unfortunate. My thoughts are with the families of the victims. I pray that those who are injured recover at the earliest. ,Trust,0.018742267042398453,0.2179804891347885,0.010704871267080307,0.3339730501174927,0.004340766463428736,0.06780242919921875,0.34533724188804626,0.0011188717326149344
471,Yesterday I had a wonderful meeting with  Ji. His humility is endearing. His wide range of social service initiatives are commendable and extremely inspiring. ,Joy,0.00011755999003071338,0.9986822009086609,0.0005031494656577706,0.00027024527662433684,5.706085630663438e-06,8.214409899665043e-05,0.00030015213997103274,3.885796832037158e-05
472,Delighted to read this. Wonderful to note how people from all walks of life in Kashi are looking forward to hosting the Pravasi Bharatiya Diwas in January next year. This programme will draw people from all over the world to the ancient and vibrant city of Kashi.  ,Trust,0.02516978420317173,0.06365887820720673,0.09268555790185928,0.19027265906333923,0.08715683966875076,0.041687268763780594,0.4929312765598297,0.006437735166400671
473,Spent time with the family of beloved Atal Ji at their residence. ,Joy,0.0001592779444763437,0.9825181365013123,0.005352324806153774,0.0006607889663428068,3.493200711091049e-05,0.0010050419950857759,0.009062090888619423,0.0012074107071384788
474,We have focussed on financial inclusion from the very beginning of our term. Be it bank accounts social security or access to credit there is a paradigm shift that is benefitting the poor and middle class. ,Joy,0.04771621897816658,0.34533587098121643,0.12884066998958588,0.04097985848784447,0.005134389270097017,0.08697596192359924,0.33563095331192017,0.009386051446199417
475,Yes it is the best of both worlds. ,Trust,0.002380613936111331,0.264116495847702,0.05919012799859047,0.008193524554371834,0.000512769678607583,0.008737796917557716,0.6436914801597595,0.013177189975976944
476,Rightly pointed. Those living in remote areas will particularly benefit thanks to the #IndiaPostPaymentsBank . ,Trust,0.0837605893611908,0.1655958741903305,0.03891979902982712,0.20690414309501648,0.012528282590210438,0.028702696785330772,0.4333289861679077,0.0302596352994442
477,Well said. ,Joy,0.012428518384695053,0.26787254214286804,0.26734018325805664,0.06420883536338806,0.011053747497498989,0.10122065246105194,0.25543078780174255,0.020444724708795547
478,Janmashtami greetings to everyone. ! ,Joy,0.0002898786624427885,0.7395520210266113,0.17162248492240906,0.0012334566563367844,0.00013673416106030345,0.0026066249702125788,0.07745332270860672,0.007105493452399969
479,Congratulations to President  and the people of Indonesia for hosting such a memorable #AsianGames2018 . These games witnessed great performances by the athletes and wonderfully manifested the spirit of sportsmanship. ,Joy,0.01349023636430502,0.8343002200126648,0.015895437449216843,0.029540130868554115,0.0010527047561481595,0.006480521522462368,0.09595179557800293,0.0032889279536902905
480,I salute the coaches support staff parents family and friends of the athletes. Thank you for constantly supporting our champions. My best wishes to all our athletes for their future endeavours. #AsianGames2018 ,Joy,0.02862984873354435,0.47667673230171204,0.02974669449031353,0.05532924085855484,0.0020715342834591866,0.0023233494721353054,0.38836854696273804,0.016854077577590942
481,During the #AsianGames2018 we consolidated our position in events where we have historically been strong and won laurels in those games in which we have not won much previously. This is an extremely positive sign and it augurs well for Indian sports. ,Joy,0.007880699820816517,0.7118145823478699,0.08627793937921524,0.08677982538938522,0.0067674764432013035,0.0028104030061513186,0.09007114917039871,0.007597906980663538
482,As the #AsianGames2018 come to a close I once again congratulate the Indian contingent for their excellent performance. The 2018 Games have been the best for India in the history of the Asian Games. Every athlete who took part in the Games is India s pride. ,Joy,0.025486953556537628,0.784256100654602,0.002504913602024317,0.052801456302404404,0.006575841922312975,0.0011922208359465003,0.11818769574165344,0.008994799107313156
483,Shri  Ji has distinguished himself in public life due to his diligence & commitment to nation building. He is particularly passionate about agriculture farmer welfare and rural development. A great orator he is also blessed with a wonderful sense of articulation. ,Joy,0.020265670493245125,0.4098130762577057,0.01659981533885002,0.22053207457065582,0.004172842018306255,0.0017897653160616755,0.32378050684928894,0.0030462651047855616
484,Delighted to have joined the programme to release the book Moving On Moving Forward A Year in Office marking the completion of one year of VP  s tenure. Sharing my remarks on the occasion. ,Joy,0.0035754467826336622,0.863253653049469,0.003674812149256468,0.0447411872446537,0.00026785291265696287,0.00024517197743989527,0.08318091183900833,0.0010609413729980588
485,Ours is a Government for the wellbeing of every Indian. UPA s telephone banking led to a massive NPA problem which we are solving. Earlier proximity to one family got few people loans. Today the poor are getting bank accounts and access to credit. ,Joy,0.0024450323544442654,0.897118330001831,0.0010000454494729638,0.006556094158440828,0.00025237759109586477,0.0004924868699163198,0.09194208681583405,0.0001935225009219721
486,Yesterday s GDP numbers indicate the good health of the Indian economy. India remains a bright spot among global economies and we remain committed to continuing the growth and reform trajectories in the times to come. ,Joy,0.002181645482778549,0.6722432374954224,0.004053082317113876,0.032026734203100204,0.0005493338103406131,0.0012138518504798412,0.28405314683914185,0.0036789949517697096
487,Earlier our postmen only brought letters. Now with the launch of the #IndiaPostPaymentsBank they will also help in ensuring banking services for citizens. ,Joy,0.030376382172107697,0.34625211358070374,0.014340346679091454,0.3241581618785858,0.04258209839463234,0.008944064378738403,0.16617953777313232,0.06716728955507278
488,Glimpses from the programme marking the launch of the #IndiaPostPaymentsBank . ,Trust,0.03229670599102974,0.05637729540467262,0.15105769038200378,0.3137311339378357,0.009131061844527721,0.03226621448993683,0.34916356205940247,0.055976346135139465
489,The launch of the #IndiaPostPaymentsBank is a watershed moment in the history of our banking sector. Using latest technology this Bank will ensure even greater financial inclusion. ,Joy,0.010737929493188858,0.553284227848053,0.052040945738554,0.04057251289486885,0.001843751291744411,0.008032284677028656,0.28534868359565735,0.04813964664936066
490,Spoke to Nagaland CM  and took stock of the situation in the wake of floods in parts of the state. Assured all possible support to the state in the rescue & relief operations. We stand shoulder to shoulder with the people of Nagaland and pray for everyone's wellbeing. ,Joy,0.002961523365229368,0.8630702495574951,0.0004072005394846201,0.11698929220438004,0.0001103226823033765,0.00030274747405201197,0.012995061464607716,0.0031636266503483057
491,Impressive hockey at the #AsianGames2018 . Congratulations to our men's hockey team for winning the Bronze. This will surely enhance the popularity of Hockey across the nation. ,Joy,0.0016874036518856883,0.565391480922699,0.2092912346124649,0.04250691831111908,2.8844529879279435e-05,0.018040353432297707,0.13262146711349487,0.030432315543293953
492,Congratulations to our women s squash team for the Silver in the team event. Their success is extremely gladdening. #AsianGames2018 ,Joy,0.0007737880805507302,0.7546842694282532,0.00853016972541809,0.009799922816455364,0.00013742739974986762,0.002971748588606715,0.21230119466781616,0.010801443830132484
493,A special moment for Indian sports! The courageous and immensely talented Amit Panghal wins the Gold in the Men s 49kg boxing event. Proud of him! #AsianGames2018 ,Trust,0.002121463418006897,0.11953125149011612,0.0028932716231793165,0.05014428496360779,8.14458544482477e-05,0.0005657626898027956,0.8197294473648071,0.004933088552206755
494,Congratulations to Pranab Bardhan and Shibnath Dey Sarkar for bringing home the Gold Medal in the Men s Bridge event. #AsianGames2018 ,Joy,0.0007983894902281463,0.673850417137146,0.0003231373557355255,0.04683566838502884,2.173843495256733e-05,0.00018939537403639406,0.27770495414733887,0.0002763202355708927
495,India Post Payments Bank offers several facilities and benefits common citizens. Here is my speech to mark its laun ,Trust,0.009690436534583569,0.06583789736032486,0.10454828292131424,0.25927773118019104,0.02407083660364151,0.03277530521154404,0.2940186560153961,0.20978085696697235
496,Deeply pained by the untimely demise of Muni Tarun Sagar Ji Maharaj. We will always remember him for his rich ideals compassion and contribution to society. His noble teachings will continue inspiring people. My thoughts are with the Jain community and his countless disciples. ,Trust,0.01224247831851244,0.09881196171045303,0.011150326579809189,0.22561870515346527,0.004968909081071615,0.023314353078603745,0.5304887890815735,0.09340449422597885
