'Id','Tweet','Emotion','Anger','Joy','Surprise','Fear','Disgust','Sadness','Trust','Anticipation'
1,From civil servants to organizers the young people I met in Amsterdam today are doing the hard work of change. And they keep at it for their communities their countries and the collective future of Europe and the world. Keep up the good work. ,Anger,0.40419358015060425,0.06414040923118591,0.05376182869076729,0.2525540292263031,0.0051824175752699375,0.12585346400737762,0.08692467957735062,0.0073895808309316635
2,The antidote to government by a powerful few is government by the organized energized many. This National Voter Registration Day make sure you're registered vote early if you can or show up on November 6. This moment is too important to sit out. ,Trust,0.02061556465923786,0.3108222782611847,0.06763765960931778,0.057163942605257034,0.002647009678184986,0.010229996405541897,0.32887980341911316,0.20200376212596893
3,The first class of Obama Fellows is full of leaders like Keith hardworking innovative and dedicated to partnering with their communities to drive transformational change. ,Trust,0.023869799450039864,0.2783140242099762,0.04707188904285431,0.014296389184892178,0.029216954484581947,0.02392479218542576,0.5824877023696899,0.000818417058326304
4,We will always remember everyone we lost on 9/11 thank the first responders who keep us safe and honor all who defend our country and the ideals that bind us together. There's nothing our resilience and resolve can t overcome and no act of terror can ever change who we are. ,Joy,0.00550463143736124,0.6549288630485535,0.0015177922323346138,0.1780705749988556,0.000140437507070601,0.0027593658305704594,0.15681789815425873,0.0002604056498967111
5,Today I m at the University of Illinois to deliver a simple message to young people all over the country: You need to vote because our democracy depends on it. I hope you'll tune in at 11am CT: ,Anger,0.3882415294647217,0.026758482679724693,0.08641340583562851,0.12727604806423187,0.009443449787795544,0.05276942998170853,0.22805102169513702,0.08104664832353592
6,Yesterday I met with high school students on Chicago s Southwest side who spent the summer learning to code some pretty cool apps. Michelle and I are proud to support programs that invest in local youth and we re proud of these young people. ,Trust,0.006462212651968002,0.23155054450035095,0.04561357572674751,0.05221295356750488,0.0017775102751329541,0.02878662198781967,0.5055817365646362,0.12801486253738403
7,Congratulations to Hawaii for winning the Little League World Series! You make America very proud. ,Joy,0.00450788764283061,0.749833345413208,0.05871765315532684,0.0051394375041127205,0.0008752692956477404,0.011157901026308537,0.12117663025856018,0.04859188199043274
8,Our statement on the passing of Senator John McCain: ,Joy,0.0021025780588388443,0.28195449709892273,0.2505699396133423,0.17612682282924652,0.004061159212142229,0.019979091361165047,0.17531011998653412,0.08989579230546951
9,Aretha helped define the American experience. In her voice we could feel our history all of it and in every shade our power and our pain our darkness and our light our quest for redemption and our hard-won respect. May the Queen of Soul rest in eternal peace. ,Joy,0.004149903077632189,0.9251993894577026,0.0008406736305914819,0.009677635505795479,0.00040718939271755517,0.01792304217815399,0.04168402776122093,0.00011814467143267393
10,Bobby Kennedy was one of my heroes. He was someone who showed us the power of acting on our ideals the idea that any of us can be one of the million different centers of energy and daring that ultimately combine to change the world for the better. ,Trust,0.0526290088891983,0.08977529406547546,0.03479006513953209,0.1237914115190506,0.013579847291111946,0.005987868178635836,0.6647745370864868,0.01467194315046072
11,I m confident that together they ll strengthen this country we love by restoring opportunity repairing our alliances and standing in the world and upholding our fundamental commitment to justice fairness responsibility and the rule of law. But first they need our votes. ,Trust,0.02808096632361412,0.2208796888589859,0.009324873797595501,0.15434710681438446,0.004820650443434715,0.031380463391542435,0.5483065843582153,0.0028596618212759495
12,Today I m proud to endorse such a wide and impressive array of Democratic candidates leaders as diverse patriotic and big-hearted as the America they re running to represent: ,Joy,0.016688881441950798,0.8187154531478882,0.027016539126634598,0.04795532673597336,0.002545161871239543,0.0114875053986907,0.07498946785926819,0.0006016491097398102
13,Mandela Day is about taking action to change the world for the better. In these young people I see Madiba's example of persistence and hope. They are poised to make this world more peaceful more prosperous and more just. ,Trust,0.012251632288098335,0.4384441673755646,0.024902205914258957,0.0285831019282341,0.019699594005942345,0.013841407373547554,0.4589840769767761,0.0032938297372311354
14,This week I m traveling to Africa for the first time since I left office a continent of wonderful diversity thriving culture and remarkable stories. As I prepare for this trip I wanted to share a list of books that I d recommend for summer reading: ,Joy,0.016482194885611534,0.6725815534591675,0.15170344710350037,0.044473372399806976,0.003749641589820385,0.005717785097658634,0.0664125382900238,0.03887943550944328
15,Congratulations to the  ! This  fan knows what it s like to lift that cup and I m happy for all the Caps fans who cheer so hard for their team and for a team that celebrates so hard with its fans. ,Joy,0.08937971293926239,0.7533844709396362,0.021355869248509407,0.010762940160930157,0.010201090015470982,0.01131034642457962,0.10045159608125687,0.0031539497431367636
16,Low plastic stool cheap but delicious noodles cold Hanoi beer. This is how I ll remember Tony. He taught us about food but more importantly about its ability to bring us together. To make us a little less afraid of the unknown. We ll miss him. ,Trust,0.007950929924845695,0.2015896886587143,0.00024472700897604227,0.22411277890205383,0.0002374900213908404,0.1623624712228775,0.40200182795524597,0.0015001001302152872
17,This National Gun Violence Awareness Day show your commitment to keeping our kids safe from gun violence. Then for everyone we ve lost take action to change our leadership and our laws until they reflect that commitment - no matter how long it takes. ,Trust,0.0676833763718605,0.09895581007003784,0.0164701659232378,0.12171975523233414,0.044387735426425934,0.15552270412445068,0.4900600016117096,0.00520045543089509
18,fail ,Sadness,0.03654564544558525,0.21493278443813324,0.10616950690746307,0.07907658815383911,0.010061771608889103,0.3249567449092865,0.22279946506023407,0.005457484163343906
19,Nothing evil about this! Head to  for The Geli  Greece ,Joy,0.0087039265781641,0.2980455458164215,0.11666901409626007,0.20597724616527557,0.0006769293104298413,0.006573327351361513,0.2639566659927368,0.09939736127853394
20, for #montecarlogalafortheglobalocean P.S. big congratulations orlandobloom on your award and continuing to shine your spotlight on the environmental and humanitarian needs ,Joy,0.0016520541394129395,0.7318257689476013,0.07630409300327301,0.0684276819229126,0.0006344065768644214,0.03920106217265129,0.08117030560970306,0.0007846496882848442
21,TODAY is National Voter Registration Day!!! Need to register to vote? Check your voter status? Find local volunteer opportunities or sign up to get reminders for voting/absentee ballot ,Trust,0.0013217313680797815,0.32985353469848633,0.020482458174228668,0.22883178293704987,0.0021696691401302814,0.00614561652764678,0.4097849726676941,0.0014102427521720529
22,You will alway have you... and me darling  ,Trust,0.007398090325295925,0.09830335527658463,0.025881953537464142,0.05803317576646805,0.0007343405741266906,0.008294330909848213,0.7971804141998291,0.00417433213442564
23,At that my friends is the cherry on top of a wonderful era. I see you and I love you  Del Mar ,Surprise,9.545113425701857e-05,0.1022876650094986,0.8007845878601074,0.001664064940996468,4.770393206854351e-05,0.005154351703822613,0.08600839972496033,0.003957764711230993
24,KAABOO   Del Mar ,Surprise,0.033366698771715164,0.05648941919207573,0.3933262526988983,0.11053285002708435,0.0075301663018763065,0.011111525818705559,0.3764090836048126,0.011234004981815815
25,KAABOO   Del Mar ,Surprise,0.033366698771715164,0.05648941919207573,0.3933262526988983,0.11053285002708435,0.0075301663018763065,0.011111525818705559,0.3764090836048126,0.011234004981815815
26,KAABOO   Del Mar ,Surprise,0.033366698771715164,0.05648941919207573,0.3933262526988983,0.11053285002708435,0.0075301663018763065,0.011111525818705559,0.3764090836048126,0.011234004981815815
27,KAABOO   Del Mar ,Surprise,0.033366698771715164,0.05648941919207573,0.3933262526988983,0.11053285002708435,0.0075301663018763065,0.011111525818705559,0.3764090836048126,0.011234004981815815
28,Omw kaaboodelmar Meet me at Sunset Cliffs 7:30pm   Del Mar ,Joy,0.008452595211565495,0.5248135924339294,0.1733071655035019,0.13214877247810364,0.0010545806726440787,0.007655898574739695,0.11787842214107513,0.034688979387283325
29,PEEK-KAABOO See you soon San Diego... link in bio   Diego California ,Fear,0.05385340005159378,0.06996424496173859,0.2547050416469574,0.2590510845184326,0.009556213393807411,0.05122692883014679,0.23937538266181946,0.06226767599582672
30,Welcome to your freedom years Miss cleowade Privileged to be living in the same lifetime my queen maskdelis  Orleans Louisiana ,Joy,0.015799548476934433,0.40423494577407837,0.301443487405777,0.011703548021614552,0.005592373665422201,0.17635144293308258,0.042037609964609146,0.04283702000975609
31,What s the difference between a piano and a fish? You can t tuna-fish  Hotel Downtown Los Angeles ,Joy,0.00107098207809031,0.5652154684066772,0.033609118312597275,0.030836962163448334,9.395803499501199e-05,0.015347176231443882,0.3406360149383545,0.01319030113518238
32,My dog has halitosis but secretly I love it. ,Surprise,0.004236828535795212,0.2676878869533539,0.4352509379386902,0.03335431590676308,0.004103053826838732,0.07531964033842087,0.17418092489242554,0.005866416729986668
33,ctrl alt delete it all ,Trust,0.008422691375017166,0.007630479987710714,0.037558089941740036,0.06219112500548363,0.010172037407755852,0.013043945655226707,0.8602906465530396,0.000690978136844933
34,name a more iconic duo... I ll wait ,Trust,0.000996272312477231,0.10191977769136429,0.23852916061878204,0.00541781447827816,0.00032350426772609353,0.049717750400304794,0.48593029379844666,0.1171654462814331
35,Couple O rugrats Nugget N Mighty ,Surprise,0.0020462193060666323,0.18492308259010315,0.44563475251197815,0.006992815528064966,0.0016924277879297733,0.013538393191993237,0.3298991024494171,0.01527318637818098
36,Well I ve penciled in MY birthday plans ! SO excited that two of my favorite bbs are hitting the road together! Catch my lil sprout  &  this fall at a city near you! ,Joy,0.000523923896253109,0.9204253554344177,0.03170651197433472,0.001474585384130478,4.394201096147299e-05,0.0006314715719781816,0.026975078508257866,0.018219104036688805
37,One year 6 continents 113 shows Witness: The Tour has been the most rewarding experience. I continue to be grateful that you let my music into your and minds. Now ,Joy,0.009447486139833927,0.8896116018295288,0.001548414002172649,0.07399114966392517,1.921863258758094e-06,0.0015040080761536956,0.019821859896183014,0.004073559772223234
38,No one has ever asked me to cut a large ribbon at an opening with oversized scissors and it makes me sad. I thought this is what popstars do. ,Sadness,0.0387318879365921,0.13147108256816864,0.009766511619091034,0.027314318343997,0.006023259833455086,0.7382239103317261,0.04415441304445267,0.004314633551985025
39,IT S THE LAST NIGHT OF #WITNESSTHETOUR Y ALL! 113 shows with perfect attendance! Grateful for everyone s love & support all year... #resilient ,Joy,0.0005208633374422789,0.8373208045959473,0.0008049797615967691,0.007571585476398468,1.0225247024209239e-05,6.527518416987732e-05,0.15326111018657684,0.00044512475142255425
40,If you boil sparkling water will it become flat ,Trust,0.001074048108421266,0.012024840340018272,0.007054643239825964,0.022266682237386703,0.0005472711054608226,0.001335364650003612,0.9533788561820984,0.0023182984441518784
41,San Diego I m coming with a larger than life show for you! New set new costumes MEGA drama! I ll be there to perform on Sunday 9/16 at 7:30p. Get your exclusive Katy Perry Cares pass (benefiting  ) to KAABOO for only $89 to see my show! ,Joy,0.005525160580873489,0.5043662786483765,0.0049834949895739555,0.08762075006961823,0.0009656818583607674,0.009118846617639065,0.38433390855789185,0.0030859000980854034
42,One of my favorite moments on this leg is being able to FINALLY visit  and bring my tour I have looked out the window of my various hotel rooms for over 10 years dreaming ,Joy,0.0012769419699907303,0.9779536128044128,0.0011813793098554015,0.01270904578268528,2.6438647182658315e-05,0.00043552793795242906,0.005747590214014053,0.0006694626063108444
43,Guys when the robots take over just tell them to calculate Pi ok ,Surprise,0.008631261065602303,0.0370585173368454,0.5576381683349609,0.009807764552533627,0.010475208051502705,0.20638075470924377,0.15010280907154083,0.01990552246570587
44,God is in the details timsek  Hyatt Sydney ,Trust,0.0010324281174689531,0.013977047055959702,0.008122317492961884,0.06840795278549194,0.00042621546890586615,0.0013387741055339575,0.9032759070396423,0.0034193838946521282
45,The end of tour tattoo tradition continues with #4 by the gentle precisionist  The planet in the middle is Saturn as this journey has taught me many lessons with a few ,Joy,0.049971893429756165,0.8784177899360657,0.0033958659041672945,0.029194585978984833,0.005113102030009031,0.005510710179805756,0.02787823975086212,0.0005178373539820313
46,Happiest birthday to my favorite Queen and constant chameleon  ,Surprise,0.00010957314952975139,0.0831494927406311,0.8939093351364136,0.0006445150938816369,3.880859730998054e-05,0.0030368806328624487,0.01515291165560484,0.003958505112677813
47,hello send a link to cow suit pls ,Joy,0.01735035888850689,0.8059640526771545,0.027699537575244904,0.016310211271047592,0.0009374903165735304,0.04076400026679039,0.08513851463794708,0.005835859104990959
48,Just a couple of lemon drops RG:    lemon! ,Fear,0.17209532856941223,0.03756171464920044,0.054406411945819855,0.521740734577179,0.003977084532380104,0.03747628629207611,0.14040647447109222,0.032335951924324036
49,You know I love a ride to a show. Excited to join  and the  for the Open Streets Festival & Celebrate LA! a free concert  on Sun 9/30! Tix available via online sweepstakes beginning 8/20. ,Joy,0.004455708432942629,0.7169315814971924,0.004774759989231825,0.00506311422213912,0.0019801147282123566,0.005399599205702543,0.2608133852481842,0.0005817632772959769
50,One shoe can change your life -Cinderella   Australia ,Trust,0.003765336936339736,0.02055957168340683,0.022632349282503128,0.05248193442821503,0.0003862841404043138,0.0035169206093996763,0.8938297629356384,0.0028278662357479334
51,ilysm ,Trust,0.02137661911547184,0.28138524293899536,0.1717825084924698,0.06824108213186264,0.006824546959251165,0.12498290091753006,0.3106335997581482,0.014773489907383919
52,BRISBANE! I ll be swinging by the Westfield Carindale before my show tonight! If you re nearby around 2pm come say hello to me and my ...and if you re not nearby we ll be doin this one ,Trust,0.04432591795921326,0.028686264529824257,0.09991172701120377,0.08079485595226288,0.3218095898628235,0.024009428918361664,0.39615973830223083,0.004302461631596088
53,... and hilarious too! Never grow up  ,Joy,0.017950544133782387,0.3592165410518646,0.19748622179031372,0.04573579132556915,0.007262676954269409,0.04980618879199028,0.3158864974975586,0.006655530538409948
54,Face it - it's always a good time to put your best foot forward   Queensland Australia ,Trust,0.005379986949265003,0.029690761119127274,0.17869730293750763,0.0746757835149765,0.0008631814271211624,0.009554620832204819,0.5995425581932068,0.10159581899642944
55,Are you America's next in the rough? Take that brave step towards a magical future! It's that time again - the  is rolling through! Get more info at ,Fear,0.049832671880722046,0.24984323978424072,0.047126974910497665,0.4185551404953003,0.05979713797569275,0.0041484227403998375,0.15898971259593964,0.011706703342497349
56,CELINE DION SHOWED ME HOW TO DO THE FAMOUS CHEST SLAP AND I DID IT TO HER WHILE SINGING FIREWORK AND I BECAME A FIREWORK  Victoria Australia ,Joy,0.08042781800031662,0.42223450541496277,0.014393390156328678,0.0344061441719532,0.008625444956123829,0.03179902210831642,0.40626776218414307,0.0018459046259522438
57,OY MELBOURNE! I ll be making a pit stop at the Westfield Southland  around 2p for a mall snack + to show off my  before my show tonight. Will I see u there? ,Anticipation,0.004876989871263504,0.0929102748632431,0.2372666448354721,0.10935328900814056,0.0002989065833389759,0.0017764848889783025,0.25099870562553406,0.30251869559288025
58,The Power Of The Internet #helpGracemeetKatyPerry ,Joy,0.037464071065187454,0.3903888463973999,0.08216886967420578,0.041412271559238434,0.01376479770988226,0.34757155179977417,0.07711711525917053,0.010112482123076916
59,thought i looked cute but I might delete  South Australia ,Trust,0.05642029643058777,0.05659481883049011,0.2037239670753479,0.15102937817573547,0.004379502031952143,0.21228888630867004,0.22175979614257812,0.09380336850881577
60,Mark your calendars! Only 100 days until the mid-term elections! Are you planning to use your voice and vote? If you re not registered yet my friends at  make it easy to do it online : ,Trust,0.004342805594205856,0.04808981344103813,0.041546884924173355,0.048957448452711105,0.0013683931902050972,0.0020570135675370693,0.8508280515670776,0.0028096006717532873
61,ADELAIDE! Keep ur peeled around 2pm if you re near the Westfield Marion  ....I may be investigating my  ,Surprise,0.009085522964596748,0.09547732025384903,0.5747051239013672,0.01705622486770153,0.0030198770109564066,0.0061403303407132626,0.24230216443538666,0.052213408052921295
62,just in case you forgot im still on tour and tonight was show 100 #witnessthetour  Entertainment Centre ,Surprise,0.0006418897537514567,0.007006241008639336,0.9462513327598572,0.016555802896618843,0.000376014068024233,0.00169903424102813,0.018372587859630585,0.009097098372876644
63,my thoughts exactly (sent to me by my girl cyn she knows)  South Australia ,Trust,0.0021984949707984924,0.04795719310641289,0.2081635445356369,0.02585529163479805,0.0005108878831379116,0.03435337170958519,0.6589927673339844,0.021968426182866096
64,Who Is America by  is the BEST and most worrisome thing on television ,Fear,0.01813432015478611,0.02637975662946701,0.10753676295280457,0.5525429844856262,0.005113945342600346,0.0533764623105526,0.21910493075847626,0.017810845747590065
65,i d like u to kno murray smelled like a spa cause he eats eucalyptus leaves all day #clelandwildlifepark  Wildlife Park ,Joy,0.005744492169469595,0.6514237523078918,0.09869611263275146,0.003629770129919052,0.0005622340249828994,0.05770957097411156,0.14705410599708557,0.035179972648620605
66,Who is she? Find out in  on newsstands now ,Anticipation,0.0021006951574236155,0.024635689333081245,0.2563773989677429,0.048750557005405426,0.0008764447993598878,0.011334010399878025,0.05374728515744209,0.6021779179573059
67,PERTH! Whatcha doin around 2pm? I may or may not do a quick pump through at the Westfield Carousel  before my show tonight to check out my  ,Fear,0.004982952028512955,0.09090254455804825,0.007368301507085562,0.8188201189041138,0.0010928683914244175,0.002315558260306716,0.07233737409114838,0.002180283423513174
68,love & strength to you  we re all here for you baby girl ,Trust,0.0008707616943866014,0.08596238493919373,0.057737819850444794,0.00616451958194375,0.0002525057934690267,0.003647657809779048,0.8438130617141724,0.0015512941172346473
69,VOGUE AUSTRALIA AUGUST 2018  ,Surprise,0.005479863379150629,0.163138747215271,0.48559412360191345,0.02812373638153076,0.0010473583824932575,0.00852347444742918,0.26517003774642944,0.04292267560958862
70,so grateful ,Joy,0.0022671029437333345,0.7131127119064331,0.03065470978617668,0.010451193898916245,0.00026955537032335997,0.008065258152782917,0.22825869917869568,0.006920741405338049
71,My was touched by Carter's story. If you're able pls help w/ his chance to defeat Childhood Alzheimer's. He's SO close to funding his clinical trial & I would love to see my KatyCats kick it over the goal & make that difference! I m donating now too! ,Trust,0.00328828115016222,0.29622718691825867,0.04809831082820892,0.026361456140875816,3.698174987221137e-05,0.012596272863447666,0.6092639565467834,0.004127544816583395
72,Was so proud to give the gift of #transcendentalmeditation to my tour mates last week lead by my beautiful friend  . We meditated as a group before our show in #Manchester tonight to reclaim the arena for JOY! AND IT WAS JOYFUL. #WitnessTheTour ,Joy,0.0029396461322903633,0.8762957453727722,0.04601173847913742,0.014724832028150558,0.004885643720626831,0.005620767828077078,0.03529132530093193,0.014230304397642612
73,found my first skin tag today. I think I m an adult now. #TGIF ,Joy,0.005847272463142872,0.5270114541053772,0.2777869999408722,0.024343928322196007,0.0005171520751900971,0.034976668655872345,0.059323906898498535,0.07019264250993729
74,Never forget everyone was once a child. ,Trust,0.006208448205143213,0.15144184231758118,0.20998504757881165,0.0036701145581901073,0.0024227502290159464,0.08883397281169891,0.5358306765556335,0.0016071569407358766
75,My Aussies & Kiwis ! For the FINALE of #WitnessTheTour (that's right shows #98-111 ) I'm bringing  to you in Perth Adelaide & Melbourne & then passing the to  in Sydney Brisbane & Auckland Pleased as punch to finally you ,Joy,0.003100393572822213,0.9540063142776489,0.007725740782916546,0.012983618304133415,7.937796908663586e-06,0.002663718769326806,0.0053390515968203545,0.014173243194818497
76,I you  and I you and I m singing this one for you tonight! ,Joy,0.0004908624687232077,0.3691738545894623,0.27809491753578186,0.005588410887867212,0.00016563330427743495,0.0015636679017916322,0.3262505829334259,0.018672047182917595
77,Oi oi  remember when we locked ourselves in a room for a few days in Santa Barbara and wrote a rad song called POWER ?! Lest you forget... ,Joy,0.0007029519765637815,0.9404730796813965,0.001475241151638329,0.01876940205693245,2.4399978428846225e-05,0.0013536877231672406,0.037182845175266266,1.8419334082864225e-05
78,WITNESS IS ,Joy,0.006387231405824423,0.5842038989067078,0.04085720330476761,0.061486899852752686,0.0006324951536953449,0.04987849295139313,0.22518767416477203,0.031366076320409775
79,IM SCREAMINGOSBEJRMF$&2 ,Surprise,0.009247254580259323,0.21807774901390076,0.37406623363494873,0.041656725108623505,0.00403551384806633,0.024878647178411484,0.312701016664505,0.015336866490542889
80,CALIFORNIANS! What s important to you? Is it gun violence? Immigration? Women s rights? Prison reform? The #CAPrimary is tomorrow 6/5. It s your chance to make your voice heard! Get informed & go Vote whatever u believe just exercise your right! ,Trust,0.0018108519725501537,0.13690686225891113,0.030278773978352547,0.014490298926830292,0.0022348437923938036,0.0006835795356892049,0.7991134524345398,0.01448131911456585
81,We just played our 80TH show for #WITNESSTHETOUR ... #andwedontstop #welloiledmachine #cookingwithgas ,Surprise,0.0007333068642765284,0.36572930216789246,0.5066398978233337,0.013836013153195381,0.00011791845463449135,0.0012839018600061536,0.06128929555416107,0.050370361655950546
82,bout to do Yoga to new Kanye record ,Surprise,0.0002652087714523077,0.03336292505264282,0.8226652145385742,0.007872004061937332,0.0003849653003271669,0.0012255026958882809,0.088126040995121,0.04609813541173935
83,Happy #PRIDE month. I see you and I love you ,Joy,0.00045399414375424385,0.5904475450515747,0.2392822653055191,0.005317231174558401,7.943036325741559e-05,0.015082502737641335,0.14599688351154327,0.00334014929831028
84,Imma #believer ,Trust,3.359625770826824e-05,0.0026078696828335524,0.0006745411083102226,0.0005141646252013743,2.2918379727343563e-06,0.0001073369276127778,0.9958791136741638,0.00018107813957612962
85,Here s something to believe in:  is really coming into her own and just put out a to one of my favorite songs she s written thus far! Has she made you a #Believer ?! LMK in the comments below #CYNNER ,Trust,0.011809690855443478,0.20972949266433716,0.2687472701072693,0.16187132894992828,0.0069250063970685005,0.005105823744088411,0.2877686321735382,0.04804273694753647
86,,Joy,0.015704816207289696,0.3509698212146759,0.14494264125823975,0.07205493748188019,0.003838303266093135,0.0941551923751831,0.2866412401199341,0.03169303014874458
87,The end is FIRES. What s not to love ,Trust,0.01267947070300579,0.1074054017663002,0.03387266397476196,0.2105674147605896,0.0020652173552662134,0.10290053486824036,0.520946204662323,0.009563103318214417
88,Meet the newest Bieber my baby sister Bay Bieber ,Surprise,1.9647330191219226e-05,0.10647880285978317,0.7255361080169678,0.0003004662867169827,1.0209342690359335e-05,0.0018766917055472732,0.013133494183421135,0.1526445895433426
89,Make sure you guys go see #CrazyRichAsians this weekend! So good. Congrats  ,Surprise,0.00035967055009678006,0.38236281275749207,0.5604129433631897,0.001279525808058679,4.1092436731560156e-05,0.0016233684727922082,0.03445558249950409,0.019465046003460884
90,,Joy,0.015704816207289696,0.3509698212146759,0.14494264125823975,0.07205493748188019,0.003838303266093135,0.0941551923751831,0.2866412401199341,0.03169303014874458
