'Id','Tweet','Emotion','Anger','Joy','Surprise','Fear','Disgust','Sadness','Trust','Anticipation'
797,The community programme in Kampala was full of vibrancy and enthusiasm. Spoke about the deep rooted ties between India and Uganda the accomplishments of the Indian diaspora and the transformative changes taking place in India. ,Surprise,0.005995684303343296,0.19930344820022583,0.6515793204307556,0.030902132391929626,0.0116898687556386,0.037553273141384125,0.023212246596813202,0.03976401686668396
798,Looking forward to addressing the Indian community in a short while at a programme in Kampala. You can watch the speech on your mobiles via the 'Narendra Modi Mobile App.' ,Joy,0.005354247987270355,0.775389552116394,0.021048864349722862,0.052328772842884064,0.002277159597724676,0.004931840114295483,0.119810089468956,0.018859462812542915
799,The focus of the talks with President  included sectors such as defence innovation investment and tourism. Together India and Uganda can make a meaningful contribution to humanity. ,Joy,0.058417320251464844,0.44189608097076416,0.08736102283000946,0.08524575084447861,0.012229968793690205,0.09840916842222214,0.2028440237045288,0.013596664182841778
800,India accords topmost importance to excellent relations with a time-tested partner like Uganda. My discussions with President  were comprehensive and will take bilateral ties to new heights. ,Joy,0.0127673065289855,0.7294453978538513,0.09555794298648834,0.017016833648085594,0.0076986318454146385,0.0626852884888649,0.0517960861325264,0.023032503202557564
801,Glimpses from the ceremonial welcome at  in Entebbe. ,Surprise,0.001881664153188467,0.20531508326530457,0.6736545562744141,0.016021765768527985,0.0006464853067882359,0.012121734209358692,0.05571860820055008,0.034640129655599594
802,I thank the wonderful people of Rwanda for their warmth and affection. This visit adds tremendous strength to closer economic and cultural relations between India and Rwanda. ,Joy,0.0005573881207965314,0.5272101759910583,0.0053174858912825584,0.07944896072149277,0.000100829747680109,0.0018117907457053661,0.3743462860584259,0.011207101866602898
803,Furthering ties of trade and commerce...President  and I addressed leading CEOs from India and Rwanda. ,Surprise,0.023095358163118362,0.1355857104063034,0.32756873965263367,0.18360726535320282,0.014049283228814602,0.0405116081237793,0.2028854638338089,0.07269655168056488
804,The Girinka Programme is helping transform the lives of people across rural Rwanda. I also told President  about the initiatives we are taking in India for the development of our villages. ,Joy,0.035318370908498764,0.7483344078063965,0.0115737896412611,0.02106580138206482,0.09551969915628433,0.04103100299835205,0.04635687917470932,0.0008000199450179935
805,Got a glimpse of rural life in Rwanda during the memorable visit to Rweru Model Village. I thank President  for accompanying me. Gifted 200 cows to villagers who do not yet own one as a part of the Rwandan Government's Girinka Programme. ,Surprise,0.005213436670601368,0.007753047160804272,0.7719928026199341,0.011406364850699902,0.005291149485856295,0.003550619352608919,0.19320808351039886,0.0015845210291445255
806,Visited the Kigali Genocide Memorial. The path of peace and brotherhood embraced by Rwanda after the unfortunate genocide of 1994 is commendable. ,Joy,0.001751988660544157,0.8192715644836426,0.004051655996590853,0.023838814347982407,0.020114019513130188,0.004449283704161644,0.12391628324985504,0.0026063784025609493
807,Wonderful interaction with the Indian diaspora in Rwanda. In every part of the part of the world the Indian diaspora is distinguishing itself and making us proud of their accomplishments. Rwanda s Indian community is a very positive influence on the India-Rwanda friendship. ,Joy,0.0006182623328641057,0.609710693359375,0.002120138145983219,0.04079985246062279,7.71193444961682e-05,0.0006160581251606345,0.3431474566459656,0.002910410752519965
808,The proposed opening of the Indian High Commission in Rwanda augurs well for our countries. The bond will deepen and various consular services will also be easily available. Here are my remarks at the press meet with President  . ,Trust,0.0031519446056336164,0.14223012328147888,0.004982987884432077,0.3064127266407013,0.000734376662876457,0.0004136770439799875,0.5399546027183533,0.002119561191648245
809,During our talks today President  and I discussed new areas of India-Rwanda cooperation in sectors such as leather and dairy research. We even talked about increasing people-to-people contacts between our nations. ,Joy,0.001002935809083283,0.7613732218742371,0.007049149833619595,0.03948650881648064,0.00011408024147385731,0.0011950195766985416,0.18970350921154022,7.560332596767694e-05
810,Held productive discussions with President  . It is a matter of great joy that India and Rwanda are working together in areas like technology infrastructure finance rural development and technology. Today s talks will further boost ties in these sectors. ,Joy,0.04044993966817856,0.4422350227832794,0.06119002029299736,0.35229596495628357,0.014885427430272102,0.007245384156703949,0.06878430396318436,0.012913944199681282
811,I would like to thank President  for personally welcoming me to the beautiful country of Rwanda. This visit will add tremendous strength to friendship between Indian and Rwanda. ,Joy,0.002607588889077306,0.5139151811599731,0.0548345185816288,0.03539322689175606,0.0006873203674331307,0.007686975412070751,0.36756396293640137,0.0173112191259861
812,On his birth anniversary my tributes to the great Chandra Shekhar Azad. A brave son of Bharat Mata he sacrificed himself so that his fellow citizens get freedom from colonialism. Generations of Indians are inspired by his courage. ,Fear,0.032485850155353546,0.002338352147489786,0.06160052865743637,0.36012333631515503,0.1652442365884781,0.004611642565578222,0.13201060891151428,0.24158543348312378
813,I bow to Lokmanya Tilak on his Jayanti. He ignited the spark of patriotism among countless Indians. He successfully mobilised people from all sections of society and deepened the connect between our citizens and India s glorious past. Lokmanya Tilak also emphasised on education. ,Joy,0.00156695325858891,0.5903604030609131,0.006616759113967419,0.24155020713806152,0.00015450612409040332,0.005124707706272602,0.14945778250694275,0.005168695002794266
814,The blessings of 125 crore Indians give me great strength. All my time is for the nation. ,Trust,0.00012089862866559997,0.2025061696767807,0.006248013116419315,0.0015497043495997787,6.529213351313956e-06,0.0017027169233188033,0.7824554443359375,0.005410500802099705
815,Point taken. :) ,Trust,0.003999978769570589,0.292885959148407,0.18723921477794647,0.040222037583589554,0.000566612055990845,0.006207350641489029,0.434099018573761,0.03477982059121132
816,Very sad to hear about your grandfather. My condolences in this sad hour. ,Sadness,0.00046604647650383413,0.0007972944877110422,0.0006930589443072677,0.0012345629511401057,0.0004970387672074139,0.9956895709037781,0.00031932725687511265,0.00030310003785416484
817,Thank you for the kind words. ,Joy,0.012123189866542816,0.43883928656578064,0.12965787947177887,0.026986321434378624,0.0030482520814985037,0.02470562234520912,0.3602753281593323,0.004364125430583954
818,Happy to read this. Please congratulate her on my behalf. Amazing to see such high levels of awareness and passion among our youngsters for Swachhata. ,Joy,0.11719153076410294,0.26297077536582947,0.14768242835998535,0.23861834406852722,0.0404752679169178,0.00558408722281456,0.12122830003499985,0.06624928116798401
819,Birthday greetings to Maharashtra's dynamic and energetic CM Shri  . His hardwork and vigour have given strong impetus to Maharashtra's progress. May Almighty bless him with a long and healthy life in service of the people. ,Joy,0.0009058178984560072,0.9160686135292053,0.0003985570219811052,0.019110528752207756,0.00013779845903627574,0.0006302718538790941,0.061949510127305984,0.0007989196456037462
820,Birthday wishes to my colleague Shri  . He has been working towards reforming the chemicals and fertilisers department. His administrative and legislative experience are an asset for us. I pray for his long life. ,Fear,0.001132130273617804,0.01765616610646248,0.0015419055707752705,0.49218320846557617,0.0007797277648933232,0.007890382781624794,0.47147655487060547,0.007339924108237028
821,People joined us in large numbers at the rally in Shahjahanpur. Spoke about the Government s efforts in agriculture steps for the welfare of sugarcane farmers and yesterday s no-confidence motion which once again brought out the Opposition s opportunism. ,Fear,0.007945485413074493,0.08913537114858627,0.006289605982601643,0.6448721289634705,0.0032069524750113487,0.0023187582846730947,0.23289057612419128,0.01334111113101244
822,,Joy,0.015704816207289696,0.3509698212146759,0.14494264125823975,0.07205493748188019,0.003838303266093135,0.0941551923751831,0.2866412401199341,0.03169303014874458
823,? ? - - ,Joy,0.025144973769783974,0.6750960350036621,0.03433845937252045,0.03193792700767517,0.004607978276908398,0.0194406695663929,0.20729012787342072,0.0021438165567815304
824,,Joy,0.015704816207289696,0.3509698212146759,0.14494264125823975,0.07205493748188019,0.003838303266093135,0.0941551923751831,0.2866412401199341,0.03169303014874458
825,80%,Trust,0.012872891500592232,0.16265594959259033,0.08096489310264587,0.02136829122900963,0.0023775503505021334,0.05493159592151642,0.6464001536369324,0.018428640440106392
826,Today is a special day for India-Sri Lanka friendship. Via technology I joined the programme marking the expansion of Emergency Ambulance Services across the entire island of Sri Lanka. PM Wickremesinghe joined the programme.  Sharing my speech. ,Joy,0.000759827671572566,0.9907532334327698,0.001003019860945642,0.001762879779562354,8.950810297392309e-05,0.0003185733803547919,0.004243130795657635,0.0010698348050937057
827,I always enjoy being with our farmers. It is due to their hardwork that India has achieved so much. Going to Shahjahanpur in Uttar Pradesh to address a Kisan Kalyan Rally this afternoon. ,Joy,0.0010751516092568636,0.9298116564750671,0.015662360936403275,0.014232759363949299,0.00011916890798602253,0.0008240400347858667,0.03310716897249222,0.005167709197849035
828,The fight against corruption and black money will continue. Due to this I know that many vested interests who have enjoyed the gravy train for 7 decades hate me but that is fine. We are here to serve the poor the marginalised and the weak. ,Joy,0.03403671830892563,0.837612509727478,0.030949555337429047,0.047406766563653946,0.005382773466408253,0.007693602237850428,0.02649296261370182,0.010425100103020668
829,Congress leaders feel I cant see them in the eye. They are correct. I am too small compared to them. How did 1 family treat Netaji Bose Sardar Patel Loknayak JP Morarjibhai Desai Charan Singh Ji Chandra Shekhar Ji Pranab Da Deve Gowda Ji & Sharad Pawar Ji? Everyone knows. ,Joy,0.006270787212997675,0.43558037281036377,0.17807281017303467,0.033470168709754944,0.001969920936971903,0.04118006303906441,0.28649038076400757,0.016965487971901894
830,Before net banking was popular there was 'phone banking' invented by the Congress. One phone call and those favoured by the Congress got loans. This created the NPA problem which our Government is solving. ,Fear,0.03780367597937584,0.10294574499130249,0.0481017604470253,0.5220757126808167,0.03368045762181282,0.007106278091669083,0.24572357535362244,0.0025627922732383013
831,I appeal to the Congress to stop calling the Surgical Strikes as Jumla Strikes. They can continue abusing me my poverty my background .but please stop mocking the armed forces. ,Joy,0.2076532244682312,0.33299458026885986,0.05721373111009598,0.05908733606338501,0.13114425539970398,0.029592620208859444,0.1807871311903,0.001527130021713674
832,I assure my sisters and brothers of Andhra Pradesh that the NDA Government will always work for their welfare and the state's growth. ,Joy,0.003616466885432601,0.5091667175292969,0.00035993504570797086,0.011862745508551598,0.00012315483763813972,0.001866436330601573,0.4729193449020386,8.517574315192178e-05
833,The NDA has the support of more than 2/3rd members of the Lok Sabha. Yesterday the nation saw yet again how the Congress is only interested in creating instability. Congress leaders did the same in 1999 and before that too! ,Joy,0.01119964849203825,0.5606439709663391,0.13174982368946075,0.09360169619321823,0.017037926241755486,0.08827774971723557,0.09024012088775635,0.007249064743518829
834,NDA has the confidence of the Lok Sabha and the 125 crore people of India. I thank all the parties that have supported us in the vote today. Our efforts to transform India and fulfil the dreams of our youth continue. Jai Hind! ,Trust,0.0040221321396529675,0.13713625073432922,0.02272825501859188,0.03745528310537338,0.00021369991009123623,0.0016532453009858727,0.7955541014671326,0.0012370373588055372
835,Speaking in the Lok Sabha. Watch. ,Joy,0.0034069239627569914,0.5374628901481628,0.019725803285837173,0.10983666032552719,0.0002830844896379858,0.06855380535125732,0.08196034282445908,0.17877046763896942
836,Today is an important day in our Parliamentary democracy. I am sure my fellow MP colleagues will rise to the occasion and ensure a constructive comprehensive & disruption free debate. We owe this to the people & the makers of our Constitution. India will be watching us closely. ,Joy,0.0018478145357221365,0.9230324625968933,0.0013537395279854536,0.022876949980854988,0.0034398057032376528,0.008593829348683357,0.03278898820281029,0.006066423375159502
837,For people in Jharkhand with Urja Shakti came Jal Shakti. Citizens in Odisha narrated how electrified villages means better facilities for children. We are leaving no stone unturned for the progress of Eastern India and are ensuring this region has top-class infrastructure. ,Joy,0.028502602130174637,0.5382063984870911,0.03293180465698242,0.19952283799648285,0.055480439215898514,0.012940976768732071,0.12252364307641983,0.00989131536334753
838,For Indira Basumatary Ji from Assam village electrification meant travelling long distances for small errands is history. It also meant digital payments are now a possibility. ,Joy,0.046885281801223755,0.8142902255058289,0.0036317924968898296,0.019503004848957062,0.004406769759953022,0.020794155076146126,0.08206454664468765,0.008424190804362297
839,Substantial number of villages without electricity were in the Northeast. This changed in the last four years. People from Manipur Arunachal Pradesh and Tripura shared their experiences. ,Disgust,0.03132900595664978,0.12758314609527588,0.0020460677333176136,0.133559912443161,0.5239114761352539,0.12855109572410583,0.052493322640657425,0.0005259544122964144
840,No more walking long distances to get kerosene and more hours to study here is how life changed for young Aarti Sharma who belongs to a village in Jammu and Kashmir. ,Joy,0.01188327744603157,0.9687122702598572,0.0004013368161395192,0.0044088950380682945,0.0005680948961526155,0.0014544512378051877,0.012300158850848675,0.00027152401162311435
841,For people living in a village near Jaisalmer the arrival of electricity brought with it many positives one of them being the joys of watching television! :) ,Joy,0.00026235016412101686,0.9661490321159363,0.0009183720103465021,0.013208278454840183,2.6706300559453666e-05,0.00011006420390913263,0.0187664981931448,0.0005586926708929241
842,A village in Tehri Garhwal was electrified around Diwali. The coming of electricity created numerous opportunities for people and furthered a spirit of self-reliance. ,Joy,0.0024435757659375668,0.7773133516311646,0.016782524064183235,0.029497675597667694,0.00012759704259224236,0.004289509262889624,0.16906772553920746,0.0004780291928909719
843,Here is the video of this morning's interaction with people who belong to villages that have been electrified in the last 4 years. It is our Government's honour that we were able to brighten so many villages across India. ,Joy,0.0054506273008883,0.8463427424430847,0.00451147323474288,0.029782351106405258,0.00027997404686175287,0.0005197070422582328,0.11265432089567184,0.00045881225378252566
844,Saddened by the demise of noted poet and lyricist Shri Gopaldas Neeraj. Shri Neeraj's unique style connected him with people from all walks of life across generations. His works are unforgettable gems which will live on and inspire many. Condolences to his admirers. ,Trust,0.014072629623115063,0.1373032033443451,0.021966876462101936,0.17717871069908142,0.0005935068475082517,0.08387207239866257,0.5622447729110718,0.002768231090158224
845,The interaction with people from villages across India that have been electrified in the last four years begins in a short while. Watch it on your mobiles via the NM Mobile App or on  . ,Fear,0.03110002912580967,0.22037860751152039,0.07700991630554199,0.31722620129585266,0.1691092997789383,0.01016606017947197,0.14766477048397064,0.02734513394534588
846,Thank you Sakshi for this wonderful letter. I am glad that #ExamWarriors helped you during your exam preparations. My best wishes. ,Joy,0.0024899370037019253,0.7978581190109253,0.014453116804361343,0.008193220011889935,0.0005231121322140098,0.016228538006544113,0.15830177068710327,0.0019522112561389804
847,Wonderful interaction with our valued NDA allies. The NDA family in united in our pursuit of development and good governance for 125 crore Indians. ,Joy,0.0011554717784747481,0.8185318112373352,0.03545327112078667,0.02794809639453888,0.00011828363494714722,0.001520710065960884,0.08621444553136826,0.029057901352643967
848,Met BJP leaders in Parliament. ,Trust,0.0032986702863126993,0.17780278623104095,0.18160925805568695,0.06154854595661163,0.0025907540693879128,0.01887345500290394,0.5273138880729675,0.026962662115693092
849,Some pictures from the all-party meeting held in Parliament earlier today. ,Joy,0.0023069411981850863,0.4933939576148987,0.3553188741207123,0.0206732340157032,0.0024839909747242928,0.017568696290254593,0.030045777559280396,0.07820852100849152
850,This interaction will take place on Thursday 19th July 2018. Join this programme via the Narendra Modi Mobile App. You can watch it live on  as well. ,Anticipation,0.0025572495069354773,0.09972824156284332,0.07357598841190338,0.1119106188416481,0.0033491679932922125,0.0009028682252392173,0.048133525997400284,0.6598423719406128
851,Looking forward to interacting with citizens from villages that have been electrified in the last 4 years. Even after 70 years of Independence these villages were in the dark. Our Government had the honour of lighting them up and give wings to the aspirations of several people. ,Joy,0.005476495251059532,0.8392189145088196,0.00813443772494793,0.02814612165093422,0.0023237131536006927,0.0025040030013769865,0.11353623121976852,0.000660096702631563
852,Delighted to address the New India Conclave in Delhi. Highlighted India s transformation and how India s youth are driving this positive change. Sharing my speech. ,Joy,0.0009386056335642934,0.9253627061843872,0.0077610076405107975,0.031003732234239578,0.00012837124813813716,0.0006211157306097448,0.03166933357715607,0.00251513603143394
853,India s farmer is the nation s pride. The hardwork of our farmers combined with the support they are getting from the Government will fulfil our dream of doubled farmer incomes by 2022 when we mark 75 years of Independence. ,Trust,0.00970142986625433,0.009973074309527874,0.05592155084013939,0.11676954478025436,0.03844865411520004,0.0069067333824932575,0.7454262971878052,0.01685274764895439
854,Those who came to power chanting Ma Mati Manush stand exposed in front of the people of West Bengal. A syndicate is running and ruining West Bengal. The recent Panchayat Polls show a total disregard for democratic ethos. West Bengal does not deserve such misgovernance. ,Sadness,0.09917464107275009,0.053308747708797455,0.054537758231163025,0.031063759699463844,0.05503159016370773,0.6775615215301514,0.02703494019806385,0.0022870611865073442
855,Explained to the farmers of West Bengal how the Central Government is ensuring robust growth in the agriculture sector. Spoke about Operation Greens PM Fasal Bima Yojana steps taken to ensure better markets and many other issues. ,Trust,0.002722187200561166,0.029896480962634087,0.0009838951518759131,0.05068690702319145,0.000345202861353755,0.001063147559762001,0.9133332967758179,0.0009688722202554345
856,Farmers of West Bengal have expressed immense joy on the historic raise in MSP. While previous Governments paid lip-service to farmers the NDA Government has left no stone unturned in facilitating a qualitative difference in their lives. ,Sadness,0.014746985398232937,0.21920359134674072,0.18827171623706818,0.034694604575634,0.04921722039580345,0.4234263002872467,0.05399586260318756,0.01644371822476387
857,I pray for the quick recovery of those injured due to the unfortunate accident during today s rally. After the programme I went to the hospital and spent time with the injured. ,Anger,0.40977001190185547,0.04893023893237114,0.10168172419071198,0.15740199387073517,0.016967233270406723,0.1688576191663742,0.09427894651889801,0.0021122179459780455
858,At the rally and on the streets of Midnapore people turned out in record numbers to bless us. These blessings deepen our resolve to work for the welfare of West Bengal.  ,Joy,0.01609407737851143,0.7113984823226929,0.04762865975499153,0.04002758488059044,0.07519835233688354,0.029190506786108017,0.07206030189990997,0.008402043022215366
859,I bow to my sisters and brothers of West Bengal. The warmth and enthusiasm I received in Midnapore will remain etched in my memory. It is clear that the people of West Bengal see  as ray of hope a party that can fulfil people s aspirations. ,Joy,0.00303091062232852,0.5142202973365784,0.0022738042753189802,0.21037207543849945,0.00023423619859386235,0.004961431957781315,0.26295632123947144,0.0019509551348164678
860,Leaving for West Bengal. Will be addressing a Kisan Kalyan Rally in Paschim Medinipur district this afternoon. You can also watch the rally live on your mobiles via the Narendra Modi Mobile App.  ,Joy,0.0012051498051732779,0.9021999835968018,0.00329878693446517,0.0047053685411810875,5.41825829714071e-05,0.0003484653716441244,0.08746268600225449,0.0007253878284245729
861,I congratulate President Putin and the people of Russia for the successful organisation of the  2018. The tournament was memorable and widely watched.   ,Trust,0.024433603510260582,0.26505061984062195,0.0829569473862648,0.1806827038526535,0.09484996646642685,0.015300806611776352,0.2979104518890381,0.03881490230560303
862,An excellent match! Congratulations to France for winning the  . They played wonderfully through the tournament and during the #WorldCupFinal  I also congratulate Croatia for their spirited game. Their performance in the World Cup has been historic. ,Joy,0.0675821527838707,0.549921452999115,0.013033672235906124,0.17617100477218628,0.09342115372419357,0.013701480813324451,0.07403197139501572,0.012137132696807384
863,Some more glimpses from the public meeting in Mirzapur. ,Trust,0.036209091544151306,0.1453201323747635,0.06559571623802185,0.28984349966049194,0.005071737337857485,0.03240037336945534,0.3016725182533264,0.12388693541288376
864,100,Surprise,0.015263553708791733,0.19621528685092926,0.32420918345451355,0.047885019332170486,0.007580609060823917,0.05261872336268425,0.30614274740219116,0.05008487030863762
865,' ' ,Trust,0.0187491774559021,0.29968446493148804,0.08979428559541702,0.14368948340415955,0.003104789648205042,0.056243084371089935,0.37440040707588196,0.014334313571453094
866,4 000 ,Joy,0.005913093686103821,0.5586508512496948,0.1898365318775177,0.032697319984436035,0.0025830715894699097,0.040309399366378784,0.14158663153648376,0.028423085808753967
867,The Bansagar project always had the potential to help so many farmers but after its foundation stone was laid in 1978 the project kept getting delayed. The NDA government ensured that the project is completed so that its benefits reach the citizens. ,Joy,0.0382818877696991,0.6228780150413513,0.03825143352150917,0.029166515916585922,0.00031538057373836637,0.0022222502157092094,0.26868826150894165,0.00019621879619080573
868,Key development projects were dedicated to the nation in Mirzapur. This includes the Bansagar Canal Project 100 Jan Aushadhi Kendras across UP and a bridge over the Ganga that will improve connectivity. Here is what I said at the public meeting. ,Trust,0.07485584914684296,0.21508552134037018,0.009955459274351597,0.043404482305049896,0.025480542331933975,0.009919299744069576,0.6176049709320068,0.0036938886623829603
869,Braving the scorching heat huge number of people attended the public meeting in Mirzapur. I am grateful to them for the strong support and immense enthusiasm. ,Joy,0.015586966648697853,0.7366968989372253,0.0015613194555044174,0.02886464074254036,0.001165032503195107,0.0029168580658733845,0.21021465957164764,0.002993593690916896
870,A book 'Meri Kashi' was released during the programme this evening which offers valuable glimpses of the development works in Kashi over the last 4 years. I thank all those who worked in compiling this book. ,Joy,0.07751637697219849,0.8470105528831482,0.015815647318959236,0.0332208052277565,0.006990746129304171,0.006460194010287523,0.011956918053328991,0.0010287733748555183
871,Happy to have interacted with eminent citizens from different walks of life. My relation with this ancient city is special. No words can do justice to the affection I have received from Kashi. ,Joy,0.007383640855550766,0.881269633769989,0.010159721598029137,0.029572658240795135,0.002885244321078062,0.010385825298726559,0.05571151152253151,0.002631751587614417
